{
  "$schema": "https://json-schema.org/draft/2020-12/schema",
  "title": "Workflow verification policy v1 / v1.1 / v1.2 / v1.3 / v1.4 / v1.5",
  "description": "Policy 1.2.0 declares any number of worker lanes from configuration: lane ids follow a fixed pattern and avoid the reserved graph names, `role` is a free label and each lane lists the check kinds it must pass in `required_check_kinds`. Policies 1.0.0 and 1.1.0 stay accepted so pinned policies in old runs still validate; for them the controller derives the required kinds from the role (frontend: build and browser; backend: unit). Policy 1.3.0 adds the optional `attack_check` (docs/PRD_ATTACK_PASS.md section 3): the command that runs one exploit test file, `{argv, timeout_seconds}` with `{file}` exactly once in `argv`; a feature with `attack` and no `attack_check` is refused at launch. `attack_check` is refused before 1.3.0. Policy 1.4.0 keeps `attack_check` and adds the optional `critique_app` (docs/PRD_USER_CRITIQUE.md section 4.2): `{argv, ready_path, timeout_seconds}`, how the critique reviewer starts the frozen candidate's app on free ports; a feature with `critique` and no `critique_app` is refused at launch. `critique_app` is refused before 1.4.0. Policy 1.5.0 keeps both and adds the optional `run_checks` (features/run-checks-once/prd.md section 6): checks that run once per candidate attempt on the combined revision, never per lane and never in the worker phase; never of kind browser, with no scenarios, ids unique and distinct from every lane check id (the controller checks that), argvs distinct. `run_checks` is refused before 1.5.0.",
  "type": "object",
  "additionalProperties": false,
  "required": [
    "version",
    "feature",
    "workers",
    "independent_review",
    "integration_approval"
  ],
  "$defs": {
    "checkKind": {
      "enum": [
        "build",
        "typecheck",
        "unit",
        "integration",
        "contract",
        "browser"
      ]
    },
    "nodeId": {
      "description": "A worker lane id: lower-case, at most 32 characters, never a fixed graph node (review, candidate, handoff, approval, integrate), a finding attribution (multiple, none, both), a per-lane node prefix (launch_, verify_, candidate_, review-), the design challenge's node and files (challenge, challenge-) or the review sidecar's (sidecar, sidecar-).",
      "type": "string",
      "pattern": "^(?!(?:review|candidate|handoff|approval|integrate|multiple|none|both|challenge|sidecar|attack)$)(?!(?:launch_|verify_|candidate_|review-|challenge-|sidecar-|attack-))[a-z][a-z0-9-]{0,31}$"
    }
  },
  "allOf": [
    {
      "if": {
        "properties": {
          "version": {
            "const": "1.0.0"
          }
        }
      },
      "then": {
        "not": {
          "anyOf": [
            {
              "required": [
                "max_verification_attempts"
              ]
            },
            {
              "required": [
                "failure_drill"
              ]
            }
          ]
        }
      }
    },
    {
      "if": {
        "properties": {
          "version": {
            "enum": [
              "1.0.0",
              "1.1.0"
            ]
          }
        }
      },
      "then": {
        "properties": {
          "workers": {
            "items": {
              "properties": {
                "role": {
                  "enum": [
                    "frontend",
                    "backend"
                  ]
                }
              },
              "not": {
                "required": [
                  "required_check_kinds"
                ]
              }
            }
          }
        }
      },
      "else": {
        "properties": {
          "workers": {
            "items": {
              "required": [
                "required_check_kinds"
              ]
            }
          }
        }
      }
    },
    {
      "if": {
        "not": {
          "properties": {
            "version": {
              "enum": [
                "1.3.0",
                "1.4.0",
                "1.5.0"
              ]
            }
          }
        }
      },
      "then": {
        "not": {
          "required": [
            "attack_check"
          ]
        }
      }
    },
    {
      "if": {
        "not": {
          "properties": {
            "version": {
              "enum": [
                "1.4.0",
                "1.5.0"
              ]
            }
          }
        }
      },
      "then": {
        "not": {
          "required": [
            "critique_app"
          ]
        }
      }
    },
    {
      "if": {
        "not": {
          "properties": {
            "version": {
              "const": "1.5.0"
            }
          }
        }
      },
      "then": {
        "not": {
          "required": [
            "run_checks"
          ]
        }
      }
    }
  ],
  "properties": {
    "version": {
      "enum": [
        "1.0.0",
        "1.1.0",
        "1.2.0",
        "1.3.0",
        "1.4.0",
        "1.5.0"
      ]
    },
    "run_checks": {
      "type": "array",
      "description": "1.5.0: checks that run once per candidate attempt on the combined revision, in the shared verification worktree after the lanes' shared commands; never per lane and never in the worker phase. A run check whose argv equals a lane check's shares that execution. They never satisfy a lane's required_check_kinds. A failing run check is attributed to one lane, or to none, by rerunning its failing tests on the candidate, the base and each lane snapshot (features/run-checks-once/prd.md sections 6 and 7).",
      "minItems": 1,
      "maxItems": 20,
      "items": {
        "type": "object",
        "additionalProperties": false,
        "required": [
          "id",
          "kind",
          "argv",
          "timeout_seconds",
          "scenarios"
        ],
        "properties": {
          "id": {
            "type": "string",
            "minLength": 1
          },
          "kind": {
            "enum": [
              "build",
              "typecheck",
              "unit",
              "integration",
              "contract"
            ]
          },
          "argv": {
            "type": "array",
            "minItems": 1,
            "items": {
              "type": "string",
              "minLength": 1
            }
          },
          "timeout_seconds": {
            "type": "integer",
            "minimum": 1,
            "maximum": 3600
          },
          "scenarios": {
            "type": "array",
            "maxItems": 0
          }
        }
      }
    },
    "critique_app": {
      "type": "object",
      "additionalProperties": false,
      "description": "1.4.0: how the critique reviewer starts the frozen candidate's app (docs/PRD_USER_CRITIQUE.md 4.2). The controller runs `argv` in the critique worktree with CRITIQUE_WEB_PORT and CRITIQUE_API_PORT set to free ports it picks, waits until http://127.0.0.1:$CRITIQUE_WEB_PORT<ready_path> answers within timeout_seconds, gives the session the URL, and stops the process group when the critique ends. Required when the feature declares `critique`; refused before 1.4.0.",
      "required": [
        "argv",
        "ready_path",
        "timeout_seconds"
      ],
      "properties": {
        "argv": {
          "type": "array",
          "minItems": 1,
          "items": {
            "type": "string",
            "minLength": 1
          }
        },
        "ready_path": {
          "type": "string",
          "minLength": 1,
          "pattern": "^/"
        },
        "timeout_seconds": {
          "type": "integer",
          "minimum": 1,
          "maximum": 3600
        }
      }
    },
    "attack_check": {
      "type": "object",
      "additionalProperties": false,
      "description": "1.3.0: the command that runs one attack-pass exploit test file. `{file}` must appear exactly once in `argv`; the controller replaces it with the test file's absolute path.",
      "required": [
        "argv",
        "timeout_seconds"
      ],
      "properties": {
        "argv": {
          "type": "array",
          "minItems": 1,
          "items": {
            "type": "string",
            "minLength": 1
          }
        },
        "timeout_seconds": {
          "type": "integer",
          "minimum": 1,
          "maximum": 3600
        }
      }
    },
    "feature": {
      "type": "string",
      "minLength": 1
    },
    "max_verification_attempts": {
      "type": "integer",
      "minimum": 1,
      "maximum": 10
    },
    "failure_drill": {
      "type": "object",
      "additionalProperties": false,
      "required": [
        "node_id",
        "phase",
        "attempt"
      ],
      "properties": {
        "node_id": {
          "$ref": "#/$defs/nodeId",
          "description": "Any declared lane; the controller checks it against `workers`. The drill applies only when that lane is selected for the run."
        },
        "phase": {
          "const": "worker"
        },
        "attempt": {
          "const": 1
        }
      }
    },
    "setup": {
      "type": "array",
      "items": {
        "type": "object",
        "additionalProperties": false,
        "required": [
          "argv",
          "timeout_seconds"
        ],
        "properties": {
          "argv": {
            "type": "array",
            "minItems": 1,
            "items": {
              "type": "string",
              "minLength": 1
            }
          },
          "timeout_seconds": {
            "type": "integer",
            "minimum": 1,
            "maximum": 3600
          }
        }
      }
    },
    "independent_review": {
      "const": true
    },
    "integration_approval": {
      "const": true
    },
    "workers": {
      "type": "array",
      "minItems": 1,
      "items": {
        "type": "object",
        "additionalProperties": false,
        "required": [
          "node_id",
          "role",
          "owned_paths",
          "checks"
        ],
        "properties": {
          "node_id": {
            "$ref": "#/$defs/nodeId"
          },
          "role": {
            "type": "string",
            "minLength": 1,
            "maxLength": 40,
            "description": "A free label used in prompts and the viewer (1.2.0). Before 1.2.0: frontend or backend, which also determined the required check kinds."
          },
          "required_check_kinds": {
            "description": "The check kinds this lane must pass; every listed kind must appear in the lane's `checks`. Required from 1.2.0.",
            "type": "array",
            "minItems": 1,
            "uniqueItems": true,
            "items": {
              "$ref": "#/$defs/checkKind"
            }
          },
          "owned_paths": {
            "type": "array",
            "minItems": 1,
            "uniqueItems": true,
            "items": {
              "type": "string",
              "minLength": 1
            }
          },
          "checks": {
            "type": "array",
            "minItems": 1,
            "items": {
              "type": "object",
              "additionalProperties": false,
              "required": [
                "id",
                "kind",
                "argv",
                "timeout_seconds",
                "scenarios"
              ],
              "properties": {
                "id": {
                  "type": "string",
                  "minLength": 1
                },
                "kind": {
                  "$ref": "#/$defs/checkKind"
                },
                "argv": {
                  "type": "array",
                  "minItems": 1,
                  "items": {
                    "type": "string",
                    "minLength": 1
                  }
                },
                "timeout_seconds": {
                  "type": "integer",
                  "minimum": 1,
                  "maximum": 3600
                },
                "scenarios": {
                  "type": "array",
                  "uniqueItems": true,
                  "items": {
                    "type": "object",
                    "additionalProperties": false,
                    "required": [
                      "id",
                      "description"
                    ],
                    "properties": {
                      "id": {
                        "type": "string",
                        "minLength": 1
                      },
                      "description": {
                        "type": "string",
                        "minLength": 1
                      }
                    }
                  }
                }
              }
            }
          }
        }
      }
    }
  }
}
